{
  "schema_version": "hqa.topology_snapshot.v1",
  "snapshot_id": "TOPO-DEMO-001",
  "timestamp_utc": "2026-06-01T00:00:00Z",
  "nodes": [
    {
      "node_id": "Q_0",
      "status": "healthy",
      "coherence_score": 0.97,
      "role": "data"
    },
    {
      "node_id": "Q_1",
      "status": "degraded",
      "coherence_score": 0.42,
      "role": "data"
    },
    {
      "node_id": "Q_2",
      "status": "healthy",
      "coherence_score": 0.96,
      "role": "ancilla"
    },
    {
      "node_id": "Q_3",
      "status": "healthy",
      "coherence_score": 0.94,
      "role": "readout"
    }
  ],
  "edges": [
    {
      "source": "Q_0",
      "target": "Q_1",
      "coupling_score": 0.81
    },
    {
      "source": "Q_0",
      "target": "Q_2",
      "coupling_score": 0.93
    },
    {
      "source": "Q_2",
      "target": "Q_3",
      "coupling_score": 0.88
    }
  ]
}